{
  "schema_version": "0.1.0-draft",
  "contract_id": "LANDSCAPE_RESEARCH_CONTRACT_v0.1",
  "status": "DRAFT_PRE_G0_NONAUTHORITATIVE",
  "as_of": "2026-09-02",
  "governance": {
    "programme_gate": "G1_RESEARCH_CONTRACT",
    "g0_dependency": "BLOCKED_NOT_PASSED",
    "g1_approved": false,
    "approval_authority": "EXPLICIT_HUMAN_PROGRAMME_GOVERNANCE",
    "automatic_approval_allowed": false,
    "validation_confers_approval": false,
    "repository_presence_confers_approval": false,
    "candidate_or_release_authority_conferred": false,
    "approval_record_required": true
  },
  "purpose": {
    "research_objective": "Construct a reproducible, evidence-bounded global NeuroAI landscape that separates inventive activity, commercial representation, exact systems, capabilities, deployment contexts, governance concerns and policy instruments without collapsing evidence states or decision authority.",
    "primary_audiences": ["POLICYMAKERS", "GENERAL_PUBLIC"],
    "secondary_audiences": ["RESEARCHERS", "TECHNOLOGY_GOVERNANCE_PRACTITIONERS"],
    "investor_analysis_is_separate": true,
    "decision_use": [
      "Map who is doing what, where, and through which technical and institutional forms.",
      "Characterize concentration, geographic distribution, inventive activity and commercialization signals under declared source protocols.",
      "Identify capability and deployment-context patterns that could implicate governance concerns under stated conditions.",
      "Generate bounded evidence for policy analysis and for selecting exact systems that merit separate v4.2 assessment."
    ]
  },
  "research_questions": {
    "primary": [
      "What organizations, products, systems, patent publications and enabling activities are observable within the declared NeuroAI research protocol, and how are they distributed across capability, application context, geography and evidence state?",
      "Where do inventive activity, commercial representation and observed system capabilities concentrate, and where do they diverge?",
      "Which recurring capability-by-context patterns could implicate specific governance concerns through explicit mechanisms, and which policy instruments are relevant to those bounded patterns?"
    ],
    "secondary": [
      "How sensitive are landscape conclusions to source universe, search language, query vocabulary, classifier choice and sampling protocol?",
      "Which gray-area nonclinical applications are missed by scientific or medical terminology and require capability-first discovery?",
      "Which exact systems warrant separate assessment because of deployment context, sensitivity, decision value or material change?"
    ],
    "prohibited_question_substitutions": [
      "Do not substitute market-size or market-share estimation for the declared evidence-bounded landscape unless a separate denominator-valid study is approved.",
      "Do not treat patent counts as product deployment, clinical value, legal validity, freedom to operate or current ownership.",
      "Do not treat product representation as effectiveness, safety, authorization, deployment or system conformance.",
      "Do not convert exploratory governance concerns into predictions of misuse or future harm."
    ]
  },
  "units_of_analysis": {
    "ORGANIZATION": "An identified organization or institutional actor. Financing, partnership, subsidiary, acquisition and ownership/control are separate relationship claims requiring their own evidence.",
    "PRODUCT": "A commercial or formally named product/family representation. Product existence or representation does not identify an exact technical configuration or prove availability, effectiveness, safety, authorization or deployment.",
    "SYSTEM": "An exact or bounded technical system/configuration suitable for capability, deployment-context or assessment claims. A PRODUCT must not be silently substituted for a SYSTEM.",
    "PATENT_PUBLICATION": "An exact patent publication identity. Publication is evidence that a patent document exists in the declared provider data, not that the invention works, is implemented, deployed, valid, enforceable or linked to a product.",
    "SOURCE": "A provenance-bearing public or controlled evidence source. Source presence is not substantive truth.",
    "OBSERVATION_ASSERTION": "A bounded observation or assertion carrying evidence, verification, review, scope, temporal and claim-boundary information.",
    "POLICY_INSTRUMENT": "A law, regulation, standard, policy or governance instrument whose relevance must be scoped to jurisdiction, capability, context and mechanism."
  },
  "scope_boundary": {
    "definition": "NeuroAI is operationalized for this programme as technologies in which neural or brain-related signals, stimulation or interfaces have a substantive computational role in inference, decoding, prediction, adaptation, control, communication, restoration, augmentation or state estimation. Borderline cases remain reviewable rather than automatically included.",
    "tiers": [
      {"tier": "A", "label": "DIRECT_NEUROAI", "rule": "Direct neural sensing, decoding, brain-computer or brain-machine interfacing, neuroprosthetic computation, or algorithmically adaptive neural stimulation/neuromodulation with a substantive computational role.", "automatic_canonical_inclusion": false, "human_review_required": true},
      {"tier": "B", "label": "ENABLING_OR_ADJACENT_NEUROAI", "rule": "Technology materially enabling direct NeuroAI systems or implementing neural-data computation, but whose relevance or system boundary cannot be established from a single discovery record.", "automatic_canonical_inclusion": false, "human_review_required": true},
      {"tier": "C", "label": "GRAY_AREA_CAPABILITY", "rule": "Nonclinical or policy-relevant uses of neural or brain-related data for attention, vigilance, affective/cognitive state, adaptive interfaces, enhancement/training, behavioral personalization, biometrics/identity or nontraditional sensing form factors where NeuroAI relevance requires capability-and-context review.", "automatic_canonical_inclusion": false, "human_review_required": true},
      {"tier": "EXCLUDE", "label": "OUT_OF_SCOPE", "rule": "Records lacking a substantive neural/brain-related signal, stimulation or interface component, or lacking a substantive computational role, except when intentionally retained as a negative benchmark or boundary case.", "automatic_canonical_inclusion": false, "human_review_required": false}
    ],
    "explicit_exclusions": [
      "Generic AI or biosensing with no substantive neural/brain-related component.",
      "Neuroscience research records with no relevant computational technology or system signal when the research question is commercial/technology landscape discovery.",
      "Pure marketing references with no identifiable product, system, organization or evidence object.",
      "Participant-level personal data and protected clinical evidence.",
      "Harmful-use recipes, operational misuse instructions or speculative abuse catalogues."
    ],
    "boundary_uncertainty_policy": "Ambiguous cases are DEFER or retained as labeled edge cases; uncertainty must not be resolved by widening canonical inclusion automatically."
  },
  "claim_evidence_matrix": [
    {"claim_type": "ORGANIZATION_OR_PRODUCT_REPRESENTATION", "minimum_evidence": ["Official organization/product page or another source that directly represents the named entity/product."], "supports": ["Representation or web presence at the observed time."], "prohibited_inferences": ["Scientific validity", "clinical effectiveness", "safety", "regulatory authorization", "commercial availability", "deployment", "system conformance"]},
    {"claim_type": "PATENT_PUBLICATION_EXISTS", "minimum_evidence": ["Exact patent-publication identity in declared patent provider data."], "supports": ["Existence of the patent publication and provider-exposed bibliographic metadata."], "prohibited_inferences": ["Implementation", "deployment", "product integration", "patent validity", "enforceability", "freedom to operate", "current ownership/control", "system capability"]},
    {"claim_type": "SCIENTIFIC_STUDY_OR_TRIAL_EXISTS", "minimum_evidence": ["Exact publication/trial registry identity in a declared source."], "supports": ["Existence and represented registry/publication metadata."], "prohibited_inferences": ["Positive result", "clinical validity", "effectiveness", "regulatory authorization", "deployment"]},
    {"claim_type": "REGULATORY_STATE", "minimum_evidence": ["Exact regulator or authoritative legal/administrative record scoped to product/system, jurisdiction and time."], "supports": ["Only the represented regulatory/legal state and scope."], "prohibited_inferences": ["Scientific truth outside the record", "deployment", "global authorization", "broad product-family status"]},
    {"claim_type": "COMMERCIAL_AVAILABILITY_OR_DEPLOYMENT", "minimum_evidence": ["Direct evidence of availability or deployment with entity/system, place/time and scope resolved."], "supports": ["Only the stated availability/deployment proposition."], "prohibited_inferences": ["Effectiveness", "safety", "regulatory approval", "market share", "system conformance"]},
    {"claim_type": "OWNERSHIP_OR_CONTROL", "minimum_evidence": ["Direct corporate, transaction, filing or other authoritative relationship evidence."], "supports": ["The exact ownership/control proposition and valid-time scope."], "prohibited_inferences": ["Ownership from financing alone", "control from partnership", "product-patent ownership from applicant-name similarity"]},